{
  "contract_version": 1,
  "contract_id": "FSC-PMEVALS-001",
  "contract_status": "APPROVED",
  "approved_at": "2026-07-16T19:30:00Z",
  "approved_by": "abhillash",
  "product_name": "pm-evals Web — Compare Eval Runs",
  "problem": "A non-technical AI Product Manager cannot tell whether a model, prompt, retrieval, or agent change is safe to release without asking an engineer to run terminal tools and interpret raw eval output.",
  "target_user": "A non-technical AI Product Manager evaluating whether a model, prompt, retrieval, or agent change is safe to release.",
  "primary_journey": [
    { "step_id": "J-1", "description": "Open the application in a browser and read a simple explanation of what it does.", "screen_id": "S-1" },
    { "step_id": "J-2", "description": "Upload the baseline eval-results JSON file.", "screen_id": "S-1" },
    { "step_id": "J-3", "description": "Upload the candidate eval-results JSON file.", "screen_id": "S-1" },
    { "step_id": "J-4", "description": "See clear validation errors if either file is malformed or the pair is incompatible.", "screen_id": "S-1" },
    { "step_id": "J-5", "description": "Click Compare Runs.", "screen_id": "S-1" },
    { "step_id": "J-6", "description": "View pass rates, net change, criterion-level improvements and regressions, newly passing and newly failing traces, hard-gate regressions, the release verdict, and the evidence supporting it.", "screen_id": "S-2" },
    { "step_id": "J-7", "description": "Filter the changed traces and inspect an individual changed trace in detail.", "screen_id": "S-3" },
    { "step_id": "J-8", "description": "Download the comparison as Markdown and as JSON.", "screen_id": "S-2" },
    { "step_id": "J-9", "description": "Start a new comparison without signing in.", "screen_id": "S-1" }
  ],
  "screens": [
    {
      "screen_id": "S-1",
      "name": "Upload & Compare",
      "purpose": "Explain the product, accept the baseline and candidate files, validate them, and start the comparison.",
      "states": ["empty", "loading", "error", "success"]
    },
    {
      "screen_id": "S-2",
      "name": "Comparison Dashboard",
      "purpose": "Show pass rates, net change, criterion deltas, changed-trace summary, verdict, and evidence; offer Markdown/JSON downloads.",
      "states": ["loading", "error", "success", "insufficient-evidence"]
    },
    {
      "screen_id": "S-3",
      "name": "Trace Detail",
      "purpose": "Inspect one changed trace: per-criterion baseline vs candidate results and the evidence fields.",
      "states": ["empty", "loading", "error", "success"]
    }
  ],
  "ui_states": ["empty", "loading", "error", "success", "insufficient-evidence"],
  "backend_capabilities": [
    { "capability_id": "BC-1", "description": "Accept baseline and candidate eval-run JSON uploads with size and format limits, processed in memory only." },
    { "capability_id": "BC-2", "description": "Validate each file against the eval-run schema and the pair for compatibility (same suite, overlapping criteria, matchable trace ids)." },
    { "capability_id": "BC-3", "description": "Compute the deterministic comparison: overall pass rates, net change, criterion-level deltas, newly passing/failing traces, hard-gate regressions." },
    { "capability_id": "BC-4", "description": "Evaluate release rules and emit PROCEED, HOLD, or INSUFFICIENT_EVIDENCE with trace-level evidence and explicit reasons." },
    { "capability_id": "BC-5", "description": "Generate downloadable Markdown and JSON comparison reports." }
  ],
  "data_entities": [
    { "entity_id": "E-1", "name": "EvalRun (uploaded baseline/candidate file)", "persistence": "none" },
    { "entity_id": "E-2", "name": "Comparison result", "persistence": "none" }
  ],
  "api_contracts": [
    { "api_id": "API-1", "method": "POST", "path": "/api/compare", "purpose": "Upload baseline + candidate, validate, and return the full typed comparison with verdict and evidence." },
    { "api_id": "API-2", "method": "POST", "path": "/api/report", "purpose": "Return the comparison as a downloadable Markdown or JSON report." },
    { "api_id": "API-3", "method": "GET", "path": "/api/health", "purpose": "Liveness for preview verification." }
  ],
  "accessibility_requirements": [
    "Every form control has an accessible label.",
    "The primary journey is completable with keyboard only, with visible focus.",
    "Automated accessibility checks (axe) pass on every screen of the primary journey.",
    "Status changes (loading, errors, verdict) are announced to assistive technology."
  ],
  "responsive_requirements": [
    "The primary journey works on a desktop viewport (>=1280px).",
    "The primary journey works on a mobile viewport (375px) without horizontal scrolling."
  ],
  "binary_release_gates": [
    { "id": "GATE-1", "description": "The full primary journey passes browser E2E against the real backend and the built preview artifact." },
    { "id": "GATE-2", "description": "Hard-gate regression fixtures produce HOLD; clean fixtures produce PROCEED; sparse fixtures produce INSUFFICIENT_EVIDENCE." },
    { "id": "GATE-3", "description": "Accessibility and mobile checks pass on the primary journey." },
    { "id": "GATE-4", "description": "Identical inputs produce identical verdicts and reports (determinism)." }
  ],
  "guardrails": [
    "Deterministic verdict for identical inputs.",
    "No uploaded data sent to third-party services.",
    "No uploaded result files permanently stored.",
    "No unsupported numerical claim.",
    "No verdict without trace-level evidence.",
    "Accessible primary journey.",
    "Responsive desktop and mobile layout.",
    "Reviewed, tested, and deployed artifact digest-identical."
  ],
  "deployment_target": {
    "kind": "containerized_preview",
    "description": "Docker Compose preview built from the frozen candidate; browser tests run against the built artifact. No cloud deployment in V1; the Vercel/Render/Fly.io seam is documented."
  },
  "out_of_scope": [
    "Authentication and user accounts",
    "Permanent cloud storage",
    "Billing",
    "Collaboration",
    "Live model execution",
    "Production observability platform",
    "Multi-project history",
    "Real production deployment",
    "External analytics",
    "Automatic public sharing",
    "Arbitrary spreadsheet formats"
  ],
  "unresolved_questions": [],
  "required_approvals": ["production deployment (out of scope for V1)"]
}
